{
  "$schema": "https://json-schema.org/draft/2020-12/schema",
  "$id": "https://openbox.ai/schemas/dev-event/1.2/dev-event.schema.json",
  "title": "OpenBox Developer-Runtime Normalized Event",
  "description": "Tool-agnostic, versioned ADAPTER-FACING event contract for developer-runtime coding tools (Claude Code, Codex, Cursor). Every provider adapter maps its native payload onto this shape (SPI emit()). The OpenBox client then RE-EXPRESSES it onto the base SDK's unified wire model — WorkflowStarted/WorkflowCompleted/SignalReceived/ActivityStarted+hook_trigger — on POST /api/v1/governance/evaluate (see MAPPING.md; ADR-0004). This is NOT a verbatim event_type pass-through: the SL-1 EXT-core accept-list is retired (E7-S2). Adding a provider never changes this contract or the wire model (PRD FR-4, architecture §1b). Verified against openbox-core internal/content/{governance,session}.go and the base contract openbox-sdk-python/openbox_core/contracts/events.py (spikes S6, S8/E7-S0).",
  "x-schema-version": "1.2",
  "x-changelog": {
    "1.2": "Adds `status` on tool results (ADR-0018 Decision 1) — the field openbox-core's per-tool success metric reads and no producer had ever written, which pinned Tool Health SUCCESS at 0%. Closed enum completed|failed, ToolResult only (payload.status also writes the row's workflow_status column, so it must not ride a lifecycle event), derived structurally and NOT content-gated. Also adds the failure/lifecycle event types SubagentStarted/PermissionDenied/APIError, which ride stock SignalReceived. Purely additive: every 1.1 event is a valid 1.2 event.",
    "1.1": "Adds the turn pair (TurnStarted/TurnCompleted → ActivityStarted/ActivityCompleted with activity_type llm_completion, ADR-0014) and the fields it needs: model, turn_index, agent_id. Widens $defs.tokens with cache_creation_input/cache_read and RE-DEFINES `input` as PURE input — the Claude Code SessionEnd rollup used to fold both cache counts into it. Additive except for that one semantic, which is why this is a version bump and not a silent edit.",
    "1.0": "Initial contract (ADR-0004 base wire unification; ADR-0013 retired the span layer without changing this shape)."
  },
  "type": "object",
  "required": [
    "schema_version",
    "event_id",
    "event_type",
    "openbox_session_id",
    "developer_did",
    "timestamp",
    "tool"
  ],
  "properties": {
    "schema_version": {
      "description": "Version of THIS event contract carried on the wire. Bumped on a breaking change to the normalized shape.",
      "const": "1.2"
    },
    "event_id": {
      "description": "Client-generated unique id for idempotent ingestion (INV-5). Retries/buffered flush reuse the same id so tokens/cost/lineage are never double-counted.",
      "type": "string",
      "minLength": 1
    },
    "event_type": {
      "description": "Developer-runtime LIFECYCLE type (adapter-facing). NOTE: CommitCreated is RESERVED — the schema branch and wire mapping exist but no adapter produces it; commit lineage flows through the git trailer and notes into the Deploy event's metadata instead. The client re-maps each onto a base-SDK wire type: SessionStarted->WorkflowStarted, SessionEnded->WorkflowCompleted, PromptSubmitted/CommitCreated/Deploy->SignalReceived(signal_name), ToolCall/ToolResult->ActivityStarted/ActivityCompleted (paired by a shared activity_id; ADR-0013 retired the span layer), TurnStarted/TurnCompleted->ActivityStarted/ActivityCompleted with activity_type llm_completion (paired by activity_id <session>:turn:<index>; ADR-0014). NOT a verbatim core event_type; the EXT-core accept-list is retired (E7-S2). See MAPPING.md §2.",
      "enum": [
        "SessionStarted",
        "PromptSubmitted",
        "ToolCall",
        "ToolResult",
        "SessionEnded",
        "CommitCreated",
        "Deploy",
        "TurnStarted",
        "TurnCompleted",
        "SubagentStarted",
        "PermissionDenied",
        "APIError"
      ]
    },
    "openbox_session_id": {
      "description": "Opaque logical session id. The client synthesizes core's jointly-unique NOT-NULL (workflow_id, run_id) from it: run_id = openbox_session_id, workflow_id = a stable per-workspace/developer identity (e.g. developer_did or repo). Both required (S6 §4).",
      "type": "string",
      "minLength": 1
    },
    "developer_did": {
      "description": "The developer/session agent DID. Shares the runtime-agent DID namespace (INV-7). Reuses agent/create identity (agent_type=developer, S6 §1).",
      "type": "string",
      "pattern": "^did:aip:"
    },
    "timestamp": {
      "description": "Event time, RFC3339. Maps verbatim to core payload's string `timestamp`.",
      "type": "string",
      "format": "date-time"
    },
    "started_at": {
      "description": "Optional start time for spanning events (ToolCall/session). RFC3339.",
      "type": "string",
      "format": "date-time"
    },
    "ended_at": {
      "description": "Optional end time for spanning events (ToolResult/session). RFC3339.",
      "type": "string",
      "format": "date-time"
    },
    "tool": { "$ref": "#/$defs/tool" },
    "tokens": { "$ref": "#/$defs/tokens" },
    "cost": { "$ref": "#/$defs/cost" },
    "span": { "$ref": "#/$defs/span" },
    "content": { "$ref": "#/$defs/content" },
    "model": {
      "description": "Provider model id that spent this event's tokens ('claude-opus-4-8', 'gpt-5-codex'). Identifier-class metadata, NOT content (INV-2) — it is the one free-form string the transcript/rollout usage projections egress, and it is bounded at the adapter boundary. Load-bearing: the backend aggregates token rollups under model-keyed composite metric keys, so a turn with no model is invisible to the dashboards it feeds. Absent when the projection found none — never back-filled from the session's model, which would attribute tokens to a model that may not have spent them.",
      "type": "string"
    },
    "turn_index": {
      "description": "Zero-based index of the model turn this event belongs to, within its session (or within its subagent). Both halves of a turn pair carry the same value; the client derives activity_id = <session>[:agent:<agent_id>]:turn:<index> from it, which is what pairs them onto one row. Set on TurnStarted/TurnCompleted only.",
      "type": "integer",
      "minimum": 0
    },
    "agent_id": {
      "description": "Subagent this event occurred inside. On turn events it partitions the activity_id so a subagent's turns never collide with the main thread's. Empty/absent on the main thread. Structural identifier (INV-2).",
      "type": "string"
    },
    "status": {
      "description": "Outcome of a tool call (v1.2, ADR-0018 Decision 1). Set on ToolResult ONLY — the client drops it on every other event type, because core copies payload.status into the row's workflow_status column for ANY event type (activities/governance/storage_event.go:417) and a lifecycle event's workflow_status means something else. This scope cannot be expressed in the subset of JSON Schema the conformance validator implements, so it is enforced by client.statusFor and asserted on the outbound bytes by conformance case C20. Structural, NOT content (INV-2): derived from which provider hook fired, or from a bound bool/int — never parsed from tool output — so it is not content-gated and ships identically with content_capture off. Core reads the literal 'completed' and nothing else (observability/errors.go:333), which is why the enum is closed rather than free-form.",
      "enum": ["completed", "failed"]
    },
    "metadata": {
      "description": "Additive per-type key/values. Lands verbatim in core payload's `metadata` (json.RawMessage). Never carries credentials/secrets (INV-1) or raw content (INV-2 — content lives only under `content`).",
      "type": "object"
    }
  },
  "additionalProperties": false,
  "oneOf": [
    {
      "title": "SessionStarted",
      "required": ["event_type"],
      "properties": { "event_type": { "const": "SessionStarted" } }
    },
    {
      "title": "PromptSubmitted",
      "required": ["event_type"],
      "properties": { "event_type": { "const": "PromptSubmitted" } }
    },
    {
      "title": "ToolCall",
      "required": ["event_type", "span"],
      "properties": { "event_type": { "const": "ToolCall" } }
    },
    {
      "title": "ToolResult",
      "required": ["event_type", "span"],
      "properties": { "event_type": { "const": "ToolResult" } }
    },
    {
      "title": "SessionEnded",
      "required": ["event_type"],
      "properties": { "event_type": { "const": "SessionEnded" } }
    },
    {
      "title": "CommitCreated",
      "required": ["event_type", "metadata"],
      "properties": {
        "event_type": { "const": "CommitCreated" },
        "metadata": {
          "type": "object",
          "required": ["commit_sha", "repo"],
          "properties": {
            "commit_sha": { "type": "string", "minLength": 1 },
            "repo": { "type": "string", "minLength": 1 },
            "branch": { "type": "string" }
          }
        }
      }
    },
    {
      "title": "Deploy",
      "required": ["event_type", "metadata"],
      "properties": {
        "event_type": { "const": "Deploy" },
        "metadata": {
          "type": "object",
          "required": ["deploy_id", "commit_sha"],
          "properties": {
            "deploy_id": { "type": "string", "minLength": 1 },
            "commit_sha": { "type": "string", "minLength": 1 },
            "repo": { "type": "string" },
            "environment": { "type": "string" },
            "deploy_did": {
              "description": "DID minted for the deploy = git hash + timestamp (FR-6).",
              "type": "string"
            }
          }
        }
      }
    },
    {
      "title": "TurnStarted",
      "description": "Opens one model turn. turn_index is required because the client derives the pair's activity_id from it; without it the pair cannot correlate. Carries no usage — the numbers are known only at the close.",
      "required": ["event_type", "turn_index"],
      "properties": { "event_type": { "const": "TurnStarted" } }
    },
    {
      "title": "TurnCompleted",
      "description": "Closes one model turn and carries what it spent: tokens (all four counts the provider reports) and the model that spent them. Both are optional — a turn the projection could not measure is still a real turn, and zero-filling would claim it spent nothing.",
      "required": ["event_type", "turn_index"],
      "properties": { "event_type": { "const": "TurnCompleted" } }
    },
    {
      "title": "SubagentStarted",
      "description": "A subagent spawned (v1.2, ADR-0018). Rides SignalReceived(subagent_started). Metadata-only: agent_id + agent_type. Carries NO signal_args — core's alignment engine treats any SignalReceived with non-empty signal_args as a NEW USER GOAL and overwrites the session's goal with them (openbox-core internal/services/age.go:112-137), so structural detail rides metadata for all three of these signals.",
      "required": ["event_type"],
      "properties": { "event_type": { "const": "SubagentStarted" } }
    },
    {
      "title": "PermissionDenied",
      "description": "A policy or classifier refused a tool call (v1.2, ADR-0018). Rides SignalReceived(permission_denied). Records THAT a decision happened and which tool it was about — never the content and never the reason (the provider's `reason` is free text and is not bound; ADR-0019 owns it). Note the provider limit: Claude Code 2.1.229 fires its PermissionDenied hook only after an auto-mode classifier denial, so a static deny rule denies WITHOUT producing this event — absence is not evidence that nothing was denied.",
      "required": ["event_type"],
      "properties": { "event_type": { "const": "PermissionDenied" } }
    },
    {
      "title": "APIError",
      "description": "A model turn ended in a provider-side error instead of an answer (v1.2, ADR-0018). Rides SignalReceived(api_error). metadata.error_type is the provider's own closed enum (rate_limit, overloaded, authentication_failed, oauth_org_not_allowed, billing_error, invalid_request, model_not_found, server_error, max_output_tokens, unknown), allowlisted at the adapter; anything else is dropped rather than egressed. Free-text error detail is NOT carried.",
      "required": ["event_type"],
      "properties": { "event_type": { "const": "APIError" } }
    }
  ],
  "$defs": {
    "tool": {
      "description": "The developer tool/action that produced the event. `kind` is the provider-agnostic tool class; `mcp_server` is required when kind=mcp (enforced by the conformance harness).",
      "type": "object",
      "required": ["name", "kind"],
      "additionalProperties": false,
      "properties": {
        "name": {
          "description": "Native tool name, e.g. 'Bash', 'Edit', 'mcp__github__create_issue'. Metadata only (INV-2).",
          "type": "string",
          "minLength": 1
        },
        "kind": {
          "description": "Provider-agnostic tool class. shell=command execution; file=file read/write/open/delete; mcp=MCP tool call.",
          "enum": ["shell", "file", "mcp"]
        },
        "mcp_server": {
          "description": "MCP server name when kind=mcp (e.g. 'github').",
          "type": "string"
        }
      }
    },
    "tokens": {
      "description": "Token usage for the turn or the session rollup (metadata only). Absent when unknown; each count absent rather than zero when the provider does not report it. Since v1.1 `input` is PURE input and the two cache counts have their own fields — v1.0's Claude Code rollup folded both into `input`, which made cache efficiency unmeasurable and a cache-heavy session look like it had spent its whole context on fresh input.",
      "type": "object",
      "additionalProperties": false,
      "properties": {
        "input": {
          "description": "Prompt tokens that were neither served from nor written to the prompt cache.",
          "type": "integer",
          "minimum": 0
        },
        "output": { "type": "integer", "minimum": 0 },
        "cache_creation_input": {
          "description": "Input tokens WRITTEN to the prompt cache (Anthropic cache_creation_input_tokens; Codex cache_write_input_tokens).",
          "type": "integer",
          "minimum": 0
        },
        "cache_read": {
          "description": "Input tokens SERVED from the prompt cache (Anthropic cache_read_input_tokens; Codex cached_input_tokens).",
          "type": "integer",
          "minimum": 0
        },
        "total": {
          "description": "Whole throughput: input + output + both cache counts.",
          "type": "integer",
          "minimum": 0
        }
      }
    },
    "cost": {
      "description": "Monetary cost for the turn/tool (metadata only). Absent when unknown.",
      "type": "object",
      "additionalProperties": false,
      "properties": {
        "amount": { "type": "number", "minimum": 0 },
        "currency": { "type": "string" }
      }
    },
    "span": {
      "description": "One semantic span for a tool call/result. Mirrors the subset of openbox-core SpanData an adapter SETS; core COMPUTES `semantic_type` server-side from these source fields (S6 §2) — the value here is the intended target and a hint. Carried in the core payload's `spans[]`.",
      "type": "object",
      "required": ["semantic_type", "stage"],
      "additionalProperties": false,
      "properties": {
        "semantic_type": {
          "description": "Target openbox-core span semantic type. Subset relevant to developer tools; all values exist in core session.go (S6 §2, verified).",
          "enum": [
            "file_read",
            "file_write",
            "file_open",
            "file_delete",
            "mcp_tool_call",
            "llm_tool_call",
            "llm_completion",
            "internal"
          ]
        },
        "stage": {
          "description": "Maps to core SpanData.stage. ToolCall emits 'started'; ToolResult emits 'completed'.",
          "enum": ["started", "completed"]
        },
        "file_path": { "type": "string" },
        "file_operation": { "type": "string" },
        "bytes_read": { "type": "integer", "minimum": 0 },
        "bytes_written": { "type": "integer", "minimum": 0 },
        "lines_count": { "type": "integer", "minimum": 0 },
        "function": { "type": "string" },
        "module": { "type": "string" },
        "mcp_server": { "type": "string" },
        "invocation_id": {
          "description": "THIS attempt at the operation (the provider's tool_use_id). Pairs a call's started and completed spans onto one span_id and keys the duration stash. LOCAL: normalized-event and spool only — never emitted as a field on the core wire payload, where it survives solely as an input to the opaque span_id hash.",
          "type": "string",
          "x-local-only": true
        },
        "operation_id": {
          "description": "WHAT the call does, identical across a RETRY of the same operation, so an approval can be consumed by the retry: activity_id derives from it, activity_id is the approval key, and core scopes both bypass grants by activity_id. Per class — shell: a hash of the command; MCP: a hash of the argument shape; otherwise the invocation (classes with no structural discriminator are never gated). Structural or hashed, never content (INV-2). LOCAL, like invocation_id: an input to the opaque activity_id hash, never a wire field.",
          "type": "string",
          "x-local-only": true
        },
        "request_body": {
          "description": "Tool input content. GATED (INV-2): present only when content-capture is enabled for the org; Guardrail-redacted at source, and capped to 65536 chars before egress (capBody, G_SEC SEC-1). Maps to core SpanData.request_body.",
          "type": "string",
          "x-content-gated": true
        },
        "response_body": {
          "description": "Tool output content. GATED (INV-2); capped to 65536 chars before egress (capBody, G_SEC SEC-1). Maps to core SpanData.response_body.",
          "type": "string",
          "x-content-gated": true
        }
      }
    },
    "content": {
      "description": "The ONLY location for raw prompt/output/file content. GATED (INV-2/OD4): absent by default; present only when an org opts in, and then Guardrail-redacted at source before egress. The conformance harness rejects any event carrying this when content-capture is disabled.",
      "type": "object",
      "x-content-gated": true,
      "properties": {
        "prompt": { "type": "string" },
        "output": { "type": "string" },
        "file_text": { "type": "string" }
      }
    },
    "verdict": {
      "description": "Canonical governance verdict for PARSING /evaluate responses. Priority: HALT > BLOCK > REQUIRE_APPROVAL > CONSTRAIN > ALLOW. NOTE: openbox-core serializes the response `verdict` field as the LOWERCASE wire strings in x-wire-mapping (verified S6, governance.go MarshalJSON), and also emits a legacy `action` field (x-legacy-action). Phase-1 observe treats every verdict as allow (D7/INV-3). CONSTRAIN is core's sandbox-enforcement tier (Verdict=1), beyond the story's 4-value set — see G3_REVIEW finding.",
      "type": "string",
      "enum": ["ALLOW", "CONSTRAIN", "REQUIRE_APPROVAL", "BLOCK", "HALT"],
      "x-wire-mapping": {
        "ALLOW": "allow",
        "CONSTRAIN": "constrain",
        "REQUIRE_APPROVAL": "require_approval",
        "BLOCK": "block",
        "HALT": "halt"
      },
      "x-legacy-action": {
        "allow": "continue",
        "constrain": "continue",
        "require_approval": "require-approval",
        "block": "stop",
        "halt": "stop"
      }
    }
  }
}
